{
  "schema_version": "2.6.12",
  "ticker": "MVLL",
  "baseline_id": "mvll-20260814-v3",
  "baseline_hash": "1a78c2f4eb1351d35d69df1a631cc01e7566b16df8183002b54d2317ec33a233",
  "activation_session": "2026-08-13",
  "required_valid_sessions": 5,
  "observed_sessions": [],
  "valid_sessions": [],
  "excluded_sessions": [],
  "live_shadow_differences": [],
  "critical_violations": [],
  "status": "FIRST_OBSERVATION_SESSION_PENDING",
  "previous_record_hash": null,
  "record_hash": "25c74cf47717d0327ee8d9e120e8bbc6097598c790d3eedbe257144d90908b8c",
  "order_authority": false
}
